source,url,content
cnn,https://www.cnn.com/2024/02/16/politics/russia-nuclear-space-weapon-intelligence/index.html,"CNN — Russia is trying to develop a nuclear space weapon that would destroy satellites by creating a massive energy wave when detonated, potentially crippling a vast swath of the commercial and government satellites that the world below depends on to talk on cell phones, pay bills, and surf the internet, according to three sources familiar with the intelligence. These sources gave CNN a more detailed understanding of what Russia is working on – and the threat it could pose – than the US government has previously disclosed . Republican Rep. Mike Turner of Ohio, the chair of the House Intelligence Committee, set off a frenzy in Washington on Wednesday when he issued a statement saying his panel “had information concerning a serious national security threat.” By Friday, President Joe Biden had publicly confirmed that Turner was referring to a new Russian nuclear anti-satellite capability — but officials have steadfastly refused to discuss it further, citing the highly classified nature of the intelligence. The weapon is still under development and is not yet in orbit, Biden administration officials have emphasized publicly. But if used, officials say, it would cross a dangerous rubicon in the history of nuclear weapons and could cause extreme disruptions to everyday life in ways that are difficult to predict. This kind of new weapon — known generally by military space experts as a nuclear EMP — would create a pulse of electromagnetic energy and a flood of highly charged particles that would tear through space to disrupt other satellites winging around Earth. Biden on Friday emphasized publicly that there is “no nuclear threat to the people of America or anywhere else in the world with what Russia is doing at the moment.” “Anything that they’re doing and/or they will do relates to satellites and space and damaging those satellites, potentially,” he said. The Defense Department and the intelligence community have tracked Russian efforts to develop a broad range of anti-satellite weapons, including an EMP, for years. And there has been a stream of intelligence reporting in recent months related specifically to Russia’s efforts to develop nuclear-powered anti-satellite capabilities, according to one defense official. But Russia has recently made progress in its efforts to develop a nuclear EMP — a related but far more alarming technology. “Our general knowledge of Russian pursuit of this kind of capability goes back many, many months, if not a few years,” National Security Council spokesman John Kirby said Thursday. “But only in recent weeks now has the intelligence community been able to assess with a higher sense of confidence exactly how Russia continues to pursue it.” The intelligence community, Biden said, had “found out there was a capacity to launch a system into space that could theoretically do something that was damaging” but that it “hadn’t happened yet.” “It’s not a new concept and, as a concept, dates back to the late Cold War,” said one US official. But, they said, “the big fear with any eventual EMP device in orbit [is] it might render large portions of particular orbits unusable” by creating a minefield of disabled satellites that “would then prove dangerous to any new satellites we might try to put up to replace or repair the existing satellites.” The Office of the Director of National Intelligence, the Defense Department and the National Security Council all declined to comment. It was not immediately clear whether the device as designed could impact GPS and nuclear command and control satellites, which operate in a higher orbit than the vast constellation of commercial and government satellites whizzing through low-Earth orbit. Those larger satellites are designed to be impregnable to a nuclear blast, but a former top space official at the Pentagon told CNN that “they could be vulnerable” depending on how close they were to the EMP, how old they are and how big the blast. ‘Last-ditch weapon’ Experts say this kind of weapon could have the potential to wipe out mega constellations of small satellites, like SpaceX’s Starlink, which has been successfully used by Ukraine in its ongoing war with Russia. This would almost certainly be “a last-ditch weapon” for Russia, the US official and other sources said — because it would do the same damage to whatever Russian satellites were also in the area. It also remains unclear how well-developed the technology is. Russia has had a number of public debacles with their nuclear technology in recent years. In 2019, seven Russians were killed in a nuclear accident that occurred while Moscow was trying to recover a nuclear-powered cruise missile that had crashed into the White Sea during a failed test. Still, a recent intelligence assessment on Russian progress so alarmed some lawmakers on Capitol Hill that Turner issued an invitation to all members of the House to be read in on the matter. Shortly thereafter, he issued the vague public statement that forced the issue into the public eye. Several sources familiar with the matter said that the exposure of the intelligence was extremely damaging because the source was incredibly sensitive. According to those sources, the intelligence community is now scrambling to figure out how to preserve its access. Biden administration officials contend that if Russia were to field a nuclear EMP, it would be the first-ever violation of the Outer Space Treaty of 1967, which bans stationing weapons of mass destruction in outer space. “It would be a violation of the Outer Space Treaty to which more than 130 countries have signed up to, including Russia,” Kirby said Thursday, without providing details. Russia has withdrawn from several arms control treaties in recent years, leaving the post-Cold War arms control architecture all but gutted."
cnn,https://www.cnn.com/2024/02/15/politics/takeaways-fani-willis-testimony-georgia/index.html,"CNN — The Georgia election subversion case against Donald Trump and 14 of his allies took a stunning turn Thursday when two top prosecutors testified under oath about their romantic relationship at a hearing triggered by allegations of self-dealing that have the potential to derail the indictment. The all-day hearing escalated steadily throughout the day, culminating with Fulton County District Attorney Fani Willis taking the witness stand for a combative brawl with defense attorneys that drew several rebukes from the judge. Republican presidential candidate, former U.S. President Donald Trump arrives on stage for a Get Out The Vote rally at the North Charleston Convention Center on February 14, 2024 in North Charleston, South Carolina. Win McNamee/Getty Images Related article Trump’s team facing a new conundrum: How to stay on the trail during a weekslong criminal trial Judge Scott McAfee convened the hearing after some of Trump’s co-defendants surfaced allegations of a relationship between Willis and Nathan Wade, whom she hired in 2021 to join the prosecution team. Trump and his co-defendants want the judge to disqualify Willis’ team from the case – or throw out the charges – because of a possible conflict-of-interest. There was talk of cash exchanging hands from Willis to Wade, where they store their money at home, CashApp usage, and their spending habits – all to get to the question of whether Willis benefitted financially from putting him on her staff. Willis was expected to return Friday to be be cross-examined by district attorney lawyer Anna Cross, but Cross said at the beginning of Friday’s hearing that she did not have any additional questions . The judge said he does not plan to issue a ruling on Friday. Here are takeaways from the hearing that was at times jaw-dropping, awkward and strikingly personal. Willis’ defiant afternoon on the stand What unfolded on Thursday is extremely rare in American courtrooms. The district attorney who has charged Trump with racketeering went under oath to defend her ethics and answer personal questions about her relationship with Wade. The risks could not be greater, and Willis’ credibility is on the line. Video Ad Feedback Erin Burnett on Fani Willis testimony: She tore into Trump's team 01:33 - Source: CNN Things quickly went off the rails. Willis didn’t act much like a traditional witness and was more like a prosecutor, arguing with the defense attorneys, raising objections, making legal arguments and even having exchanges with the judge. She even raised her voice at one point. This led to a few rebukes from McAfee, who urged her and other attorneys in the courtroom to maintain “professionalism” and to not “talk over each other.” Willis repeatedly accused some of the defense attorneys of peddling lies – before and after the judge’s admonishment. “You’ve lied in this. … I think you lied right here,” Willis said to attorney Ashleigh Merchant, pointing to copies of filings that raised accusations of self-dealing and nepotism. ‘I’m not on trial,’ Willis says Willis seized several opportunities to defend herself. The district attorney had fought efforts to make her appear, both in Wade’s ongoing divorce proceedings and in the hearing on Thursday, up until the moment she came into the room to take the stand. She said at the beginning of her testimony that she was “very anxious” to defend herself, “so I ran to the courtroom.” “You think I’m on trial,” Willis said, in her sharpest pushback of the day. “These people are on trial for trying to steal an election in 2020,” she added, pointing toward the table of attorneys representing defendants in the criminal case. “I’m not on trial, no matter how hard you try to put me on trial.” She later slammed the defense attorneys, calling them “confused” and “intrusive.” “Ms. Merchant’s interests are contrary to democracy, not to mine,” Willis said, attacking the attorney for Trump campaign attorney Michael Roman, who is accused of playing a leading role in the multi-state “fake electors” plot to subvert the Electoral College. When did the relationship start? On the stand, Wade stuck to his earlier claim – in a sworn affidavit submitted to the court – that his romantic relationship with Willis began in early 2022 and that they split travel and vacation expenses. But Robin Bryant-Yeartie, a former friend of Willis and Fulton County employee, contradicted that claim, testifying that she had “no doubt” that the Willis-Wade affair began in late 2019. Notably, that would be before Willis hired Wade to lead the Trump probe in late 2021. Bryant-Yeartie said she observed “hugging, kissing, close affection” between Willis and Wade prior to 2022, when they claimed their romantic relationship began. She also testified that Willis had told her in 2020 and 2021 that she was dating Wade. There was some Clinton-esque parsing of words on whether Wade cheated on his ex-wife by being with Willis. Past filings from Roman’s team salaciously noted that she had been dating “a married man.” Wade testified that his previous marriage was broken since 2015, long before his relationship with Willis began, saying, “My marriage was irretrievably broken” in 2015, and “I was free to have a relationship.” Wade and Willis describe using cash for reimbursements Wade and Willis have offered a simple explanation for why there’s essentially no paper trail to back up his claims they split expenses: Willis used cash. Credit card statements submitted in Wade’s divorce proceedings show he paid for two flights for them in recent years, to San Francisco and Miami. They also took lavish trips to Belize, the Bahamas and some Caribbean cruises. When pressed on whether he paid for Willis’ travel when they vacationed together, Wade said that Willis reimbursed him for a flight “in cash.” Wade said he did not have receipts for all of the times Willis reimbursed him for trips – pushing back against the allegations from the defense side that Willis was essentially getting kickbacks from him in the form of vacations. “I did not deposit the cash in my account,” Wade replied, smirking at times. Defense attorney Craig Gillen, who represents one of the fake electors, grilled Wade on what he would do with the cash reimbursements – in at least one case, thousands of dollars. “You don’t have a single solitary deposit slip to corroborate or support any of your allegations that you were paid by Ms. Willis in cash?” Gillen shot back, raising his voice slightly. “No sir,” Wade said, to which Gillen replied: “Not a single solitary one?” “Not a one,” Wade responded. Willis: ‘I don’t need anybody to foot my bills’ There was also a dispute over when the relationship ended, and whether it had any impact on the decision to seek the massive RICO indictment against Trump and others in last August. Both said the relationship ended in summer 2023. Willis implied that the physical component ended earlier in the summer, but that the two had a “tough conversation” that fully ended things afterward. Trump lawyer Steven Sadow asked Willis about the breakup, eliciting an answer that revealed sexist remarks that Wade allegedly made to Willis in the past. She said, he “is used to women that, as he told me one time, ‘the only thing a woman can do for him is make him a sandwich.’” She explained that this was a part of their breakup – but it also was a defense to the self-dealing claims against her. “We would have brutal arguments about the fact that ‘I am your equal,’” Willis said. “I don’t need anything from a man – a man is not a plan. A man is a companion. And so there was tension always in our relationship, which is why I would give him his money back.” Willis added, “I don’t need anybody to foot my bills.” Earlier, Sadow asked Wade during his own testimony whether the two had any “personal relationship at all” since their relationship ended, saying “and you know what I mean by that.” Wade shot back, asking if Sadow meant “if I had intercourse with the district attorney.” “We’re very good friends, probably closer than ever because of these attacks,” Wade said. “But if you’re asking me about specific intercourse, the answer is no.” Huge distraction from the charges against Trump – for now Nothing that happened Thursday undercut the factual allegations against Trump, Rudy Giuliani, Mark Meadows, or the other GOP allies who are accused of trying to overturn the 2020 election. But the hearing shifted the conversation away from those allegation and away from Trump’s legal woes for now. Earlier in the day, a New York judge set the trial date for Trump’s historic first trial, in the hush-money criminal case, for March 25. But by the afternoon, that news was nearly washed away by the jaw-dropping testimony taking place in Atlanta and being beamed across the country on national television. (Unlike the New York case, cameras are allowed in Georgia courtrooms.) Friday, a separate New York judge is expected to issue his decision in the Trump civil fraud case that’s an existential threat to his business. State prosecutors want that judge to issue a $370 million fine against Trump, after finding that Trump and his company committed significant fraud against banks and insurers by lying about his net worth and assets. They also want Trump barred from doing business in New York. This story has been updated with additional developments. CNN’s Zachary Cohen, Jason Morris, Nick Valencia, Hannah Rabinowitz, Maxime Tamsett, Shirin Faqiri, Jim Rogers, Sarah Davis, Eva Roytburg and Fabiana Chaparro contributed to this report."
cnn,https://www.cnn.com/2024/02/16/politics/biden-east-palestine-visit/index.html,"Washington CNN — The Norfolk Southern train derailment that sent toxins into the soil, water and air of East Palestine, Ohio, was an “act of greed,” President Joe Biden said Friday as he visited the town for the first time. Describing the crash as “an act of cruelty that was 100% preventable,” Biden said the administration had been pushing railroad companies to take more precautions prior to the February 3, 2023, Norfolk Southern derailment. “Multibillion dollar railroad companies transporting toxic chemical have a responsibility to do it safely,” Biden said Friday. Norfolk Southern, he said, “failed.” “While there are acts of God,” Biden said, “this was an act of greed.” While nobody was killed in the Norfolk Southern crash, the train’s derailment and the later decision to vent and burn five tankers containing cancer-causing vinyl chloride created a plume of toxic smoke that could be seen from space and caused a panic over the quality of the town’s drinking water. More than 1 million pounds of toxins were put into the town’s water, air and soil as a result of the derailment and its aftermath. Hundreds of residents were ordered to evacuate. Some moved away permanently. Others said they had developed rashes, sore throats, nausea and headaches after eventually returning to their homes, and worried the symptoms were related to chemicals released after the derailment. Biden had been under pressure to visit East Palestine since the derailment. The White House said shortly after the train’s derailment that the president would find a time to visit, but that did not happen last year. Former President Donald Trump visited East Palestine about three weeks after the derailment on February 22, and Transportation Secretary Pete Buttigieg visited the next day . Trump during his visit criticized Biden’s absence and what resulted was a political uproar, all while residents said they simply wanted to know whether their water was safe to drink. In the town on Friday, both Biden and Environmental Protection Administration Administrator Michael Regan sought to reassure residents that the administration’s focus was on helping clean the town up and hold Norfolk Southern accountable from the crash since the outset - including Biden’s signing of an executive order in September ordering federal agencies to hold the company responsible for cleaning up the mess and reporting progress. The company reported last summer that costs associated with the cleanup were around $1 billion. While visiting with East Palestine residents, Biden drank local tap water and sipped on coffee that was brewed with the tap water and local beans, according to the traveling press pool. He also announced his administration was awarding six National Institutes of Health grants to research the short- and long-term effects of the derailment. Biden’s visit comes at the invitation of East Palestine Mayor Trent Conaway and other community leaders, according to the White House. Conaway has been critical of Biden’s failure to visit East Palestine sooner, telling Fox News last month: “My personal opinion is the best time for him to come would be February of 2025, when he is on his book tour.” Speaking after Biden and Regan, Conaway on Friday said the president’s visit was “long awaited.” East Palestine, Conaway said, will “not be defined by this single event – rather our response to it and our perseverance.” “President Biden, your long-awaited visit to our village today allows us to focus on the things we agree with, acknowledge this disaster should never happen, address the long-term health concerns and the economic growth of the village and ensure this never happens again to another community,” Conaway said. The White House said the president would visit East Palestine to “meet with residents impacted by the Norfolk Southern train derailment and assess the progress that his Administration has helped deliver in coordination with state and local leaders to protect the community and hold Norfolk Southern accountable.” “He also has heard loud and clear from the folks in East Palestine that they don’t want to be defined by an event,” White House press secretary Karine Jean-Pierre said earlier this week. “And so, he’ll speak to the administration’s work to deliver on the needs for family businesses that are affected.” Biden echoed that message on Friday, promising his administration would stick with its efforts to help the town recover. “It doesn’t matter if you’re Democrat or Republican or independent. What matters is we’re all Americans, everyone, everyone, we look out for one another. We leave no one behind and we come back stronger than before. That’s what you’re doing here. That’s what’s happening right here in this community,” Biden said. “A vast majority has been done. But we’re gonna stay to the very end until every deed is met.” Buttigieg said last month efforts to address rail safety have been stymied by Republicans in Congress. “Almost one year after the Norfolk Southern derailment, Congress has still not passed the bipartisan Railway Safety Act,” he said. “It should not be the case that one year after that derailment, we are still waiting for Congress to act, and yet we have seen many who had a lot to say about this in Congress a year ago still not make clear on the record whether they are for or against this bill, and we’ve seen some House Republicans who have now voted twice to pass legislation that would cut railroad safety fund funding and track inspections.” But Buttigieg previously acknowledged some mistakes in his own response, saying he should have visited East Palestine sooner and that he failed to anticipate the political fallout from the derailment. The Environmental Protection Agency has overseen the removal of more than 174,000 tons of contaminated soil from the site, but questions about whether toxins still lurk remain. Regan told reporters last month that his agency was confident “the residents of East Palestine are not at risk from impacted surface water, soil or air from the derailment.” This story has been updated with additional developments. CNN’s Sam Fossum contributed to this report."
cnn,https://www.cnn.com/2024/02/16/politics/gaetz-ex-girlfriend-subpoenaed-house-ethics-committee/index.html,"CNN — The House Ethics Committee investigating Rep. Matt Gaetz has subpoenaed his ex-girlfriend who was a key witness in the federal investigation into the Florida lawmaker, according to her lawyer Tim Jansen. She is scheduled to testify, via a video call, on February 29, and Jansen said she will invoke the Fifth Amendment right against self-incrimination. The woman, a former Capitol Hill staffer, has been linked to Gaetz as far back as the summer of 2017 . Investigators were interested in that time frame because that is when the congressman is accused of having sexual contact with another woman, who was 17 years old at the time. CNN has reached out to Gaetz for comment on the subpoena, which was f irst reported by ABC News. A spokesperson for the House Ethics Committee declined to comment on the matter. The ex-girlfriend was granted immunity in the federal criminal probe and testified before a grand jury in January 2022. That federal probe concluded in 2023 with no charges brought against the congressman. Gaetz has repeatedly denied any wrongdoing, including ever having sex with a minor or paying for sex."
