source,url,content
cnn,https://www.cnn.com/2024/02/16/politics/trump-january-6-civil-lawsuits/index.html,"CNN — Civil lawsuits seeking to hold Donald Trump accountable for the January 6, 2021, US Capitol attack can move forward after the former president declined to ask the Supreme Court to decide whether he is shielded by presidential immunity. A federal appeals court in December cleared the way for three lawsuits brought against Trump by Democratic lawmakers and US Capitol Police officers to proceed, unanimously holding that not everything a president does or says while in office is protected from liability. Trump faced a Thursday deadline to seek the Supreme Court’s review of that decision, but his legal team declined to turn to the high court. The decision means the lawsuits will move to a fact-finding phase at the trial-level federal court in Washington, DC. Trump can continue to claim presidential immunity before that court, but it will be up to the judge overseeing the case to determine whether the conduct at issue was done in Trump’s official capacity as president or as a candidate and therefore not shielded by presidential immunity. The case could still eventually come before the Supreme Court. The decision to not turn to the justices is a departure from how Trump’s team has been handling stinging lower-court rulings as he barrels toward the 2024 Republican presidential nomination. On Monday, the former president asked the Supreme Court to temporarily block a unanimous decision issued last week by the DC Circuit Court of Appeals that rejected his claim that he’s immune from criminal election subversion charges brought by special counsel Jack Smith. And last week, the justices heard oral arguments in a dispute over whether Trump should be disqualified from the ballot for his conduct on January 6, with a majority of them appearing ready to back the former president in the case. In the civil immunity matter, the plaintiffs in the three underlying lawsuits have all seized on Trump’s speech on January 6, alleging that his words led to the subsequent attack on the Capitol. The lawmakers claimed in a pair of lawsuits that they were threatened by Trump and others as part of a conspiracy to stop the congressional session that would certify the 2020 presidential election. They argue Trump should bear responsibility for directing the assaults. The police officers said in their suit that they were hit by chemical sprays and objects attendees threw at them because Trump inspired the crowd. Lower courts sided with the plaintiffs as Trump sought to have the cases dismissed based on his claims of presidential immunity. A federal judge in DC ruled in 2022 that Trump’s statements to his supporters before the riot “is the essence of civil conspiracy” because Trump spoke about himself and rallygoers working “towards a common goal” of fighting and walking down Pennsylvania Avenue. The DC Circuit later upheld that ruling , saying in December that the president “does not spend every minute of every day exercising official responsibilities.” “And when he acts outside the functions of his office, he does not continue to enjoy immunity. … When he acts in an unofficial, private capacity, he is subject to civil suits like any private citizen,” the court said in the unanimous ruling authored by Chief Judge Sri Srinivasan. The Supreme Court is still considering whether to step into Trump’s federal criminal case related to January 6. In his emergency request earlier this week, the former president asked the high court to pause the DC Circuit’s ruling so he can appeal it to the justices and, potentially, a panel consisting of all the judges on the appeals court. In the DC Circuit’s ruling last week, the judges left no question that Trump can be prosecuted by Smith, writing: “For the purpose of this criminal case, former President Trump has become citizen Trump, with all of the defenses of any other criminal defendant.” “But any executive immunity that may have protected him while he served as President no longer protects him against this prosecution,” the judges said. For now, Trump’s trial on federal charges that he worked to undermine the results of the 2020 election remains paused as the high court considers what to do with his emergency request. CNN’s Katelyn Polantz, John Fritze and Holmes Lybrand contributed to this report."
cnn,https://www.cnn.com/2024/02/16/politics/navalny-death-biden-trump-divide/index.html,"CNN — The announcement of Alexey Navalny’s death on Friday thrust fresh urgency into the roiling debate in Washington over how forcefully to counter Russia and its president, Vladimir Putin, a question of wide-ranging consequence on which President Joe Biden and his likely opponent Donald Trump have adopted diametrically opposed positions. The disparity in how the two men reacted to the news underscored the divide. “Make no mistake: Putin is responsible for Navalny’s death. Putin is responsible. What has happened to Navalny is yet more proof of Putin’s brutality. Nobody should be fooled,” Biden said from the Roosevelt Room of the White House on Friday, forcefully pinning blame on “Putin and his thugs.” Trump, meanwhile, said nothing directly about the Russian opposition leader in a post that his campaign said was his official response to Navalny’s death. Instead, he spent the morning posting more than 20 times on Truth Social about his criminal cases, his election poll numbers, immigrants in the US, his GOP presidential rival Nikki Haley, the Teamsters labor union and Fulton County District Attorney Fani Willis’ testimony in Georgia. For Democrats and a minority of Republicans who are proponents of a muscular American presence in Europe within the NATO defense alliance, Navalny’s death served as yet another grim reminder of Putin’s brutality and the necessity of a US-led effort to isolate Moscow. But for skeptics in the Trump camp, it was far from clear whether even the death in a notoriously brutal prison camp of Putin’s leading critic would alter a hardening view that Russia’s aggression no longer requires robust western reprisals, and that the nearly 80-year-old US-led security architecture in Europe is outdated. The stakes could hardly be higher, and Biden warned forcefully from the White House that “history is watching” the debate unfold. “The failure to support Ukraine at this critical moment will never be forgotten,” Biden said Friday. “It’s going to go down in the pages of history. It really is. It’s consequential. And the clock is ticking.” The decision US politicians make in the coming weeks and months on whether to continue sending assistance to Ukraine could dramatically alter the battlefield realties there and send a global signal of American willingness not only to push back on Russia but to involve itself abroad at all. Other top Biden administration officials wasted little time pinning blame on Navalny’s death directly on Putin, even as the Kremlin said it was working to determine the cause. “Whatever story they tell, let us be clear Russia is responsible and we’ll have more to say on this later,” Vice President Kamala Harris said at the start of an address at the Munich Security Conference, where American support for Ukraine and to its NATO commitments has been a central and pressing topic of conversation. A few moments earlier, Secretary of State Antony Blinken linked Navalny’s death directly to Russia’s president. “His death in a Russian prison and the fixation and fear of one man only underscores the weakness and rot at the heart of the system that Putin has built,” the US top diplomat said at the start of a meeting with Indian officials on the sidelines of the Munich gathering. Lingering just underneath those pronouncements was the reality that in the United States, the long-held consensus on the value of alliances and systems to guard against Russian aggression is fraying. Asked whether Navalny’s death might spur Congress to act in providing more Ukraine aid, Biden was hopeful. “I hope to God it helps,” he said. Trump has shattered orthodox thinking Trump, who seems to be reveling in undermining what had been a bipartisan consensus in American foreign policy for more than 70 years, has said he would encourage Russia to attack NATO allies who “didn’t pay” — a remark that sent shockwaves through the defense alliance , which had already been bracing for his potential return to office in 2025, but was hardly surprising to his followers. Republican House Speaker Mike Johnson and fellow Republicans have refused to consider a spending package that includes around $60 billion in new funding for Ukraine, despite administration warnings that Ukrainian troops are running out of ammunition and failing to support Kyiv would amount to a victory for Putin. Even so, Johnson said in a statement Friday that Putin “is likely directly responsible” for Navalny’s death. And Tucker Carlson, the former Fox News host with a major conservative following, returned from an interview with Putin last week (which even Putin complained was too soft) proclaiming how much nicer and cleaner Moscow was than any American city. Trump has reportedly mused about selecting Carlson as a running mate. A select number of Republicans have sought to guard against the growing strain of isolationism within their party. On Friday, Trump’s sole remaining competitor for the Republican presidential nomination, former South Carolina Gov. Nikki Haley, assailed her opponent for saying he would encourage Russia to invade other nations. “Think about what that says, that Trump’s siding with a thug who kills his political opponents. By the way, he killed another one this morning,” Haley said on a South Carolina radio show. “He’s siding with Putin, who continues to try and destroy America at every turn.” For Biden and his top officials, the assault on international norms and institutions has generated both fury and concern. Biden was aghast at Trump’s remark when he learned about it last weekend and condemned it as “dumb” and “un-American” in a speech from the White House on Tuesday. A campaign issue On Friday, the Biden campaign unveiled a new digital ad blasting Trump’s comment. “Every president since Truman has been a rock-solid supporter of NATO - except for Donald Trump,” a narrator says as images of Trump with Putin flashes across the screen. “Trump wants to walk away from NATO. He’s even given Putin and Russia the greenlight to attack America’s allies.” Part of a three-week, six-figure digital ad campaign, the spot is set to run through Super Tuesday targeting voters in the battleground states of Michigan, Wisconsin and Pennsylvania. The campaign said it was looking to reach more than 2.5 million Americans who identify as Estonian, Finnish, Latvian, Lithuanian, Norwegian and Polish — all NATO countries bordering Russia. In 2021, Biden emerged from his first (and, so far, only) face-to-face meeting with Putin to say he had warned his counterpart that he’d be punished if Navalny were to die in prison. “I made it clear to him that I believe the consequences of that would be devastating for Russia,” Biden said in Geneva, where the summit was held. Since then, the United States and its partners in Europe and Asia have piled sanctions on Russia for its invasion of Ukraine, seeking to isolate the country from the global financial system and ratchet up costs on the perpetrators of the war. But it’s those same sanctions that have caused energy prices to rise in Europe and taken a toll on the global economy, lending grist to some Republican efforts to halt foreign funding for Ukraine’s military and urge an immediate end to the conflict. As American assistance for Ukraine wavers, defense officials have warned of the consequences on the battlefield. On Friday, an official told reporters the US is “sixteenth in the world” among the countries providing security assistance to Ukraine when considering the percentage of GDP. “At this point, the United States is — we’re not the top donor to Ukraine when it comes to security assistance, or economic assistance for that matter,” the official told reporters. “When you look at security assistance, we’re actually the sixteenth in the world when it comes to percentage of GDP. So we have a lot to appreciate from our allies and partners.” Harris, who was already preparing to provide reassurances to rattled allies during her visit to the Munich conference this week, sought to underscore American commitment to protecting democracy and freedom around the world, and took veiled aim at Trump for suggesting otherwise. “They suggest it’s in the best interest of the American people to isolate ourselves from the world, to flout common understandings among nations, to embrace dictators, and adopt the repressive tactics and abandon commitments to our allies in favor of unilateral action,” Harris said in her remarks at the yearly gathering of US and European leaders, which has traditionally acted as a citadel of transatlanticism. “Let me be clear—that worldview is dangerous, destabilizing and indeed shortsighted,” she said. Shortly after Harris left the stage, Navalny’s wife made a surprise appearance in Munich to urge the international community to fight against Putin’s “horrific” regime. “They will be brought to justice, and this day will come soon,” she said. CNN’s Haley Britzky, Lauren Fox and Kate Sullivan contributed reporting."
cnn,https://www.cnn.com/2024/02/16/politics/alejandro-mayorkas-cnntv/index.html,"CNN — Homeland Security Secretary Alejandro Mayorkas on Friday defended his record on the border, saying his impeachment by House Republicans has no basis in fact or law and he has no plans to slow down his work. In an interview with CNN’s Christiane Amanpour at the Munich Security Conference, his first since Tuesday’s impeachment vote, Mayorkas downplayed the vote’s effects on his day-to-day job, despite becoming the first Cabinet secretary to be impeached in 150 years. “I don’t let it distract me from the work – would I have preferred that correctness had prevailed? Of course,” Mayorkas told Amanpour. “So, the fact that it did not, does not, slow me down in doing the work that I’m tasked to do by the president of the United States.” The embattled homeland security secretary spoke to CNN on the sidelines of the annual security conference. In a wide-ranging interview, he also commented on the reported death of Russian opposition leader Alexey Navalny and defended President Joe Biden’s mental acuity in the wake of special counsel Robert Hur’s report. As a member of the administration’s delegation to the conference, Mayorkas rebuffed the idea that Tuesday’s impeachment had compromised his standing with world leaders. “They very, very well understand the politics of the moment – not only in the United States, but in their respective countries as well,” he said. “And the leaders with whom I am meeting, the great majority of which I have met before – they know me. They know me, they know the seriousness of my purpose, and the fact that I am focused on mission. The politics are an aside.” Mayorkas left the door open to defending himself during impeachment proceedings in the Senate but declined to weigh in definitively either way, telling Amanpour, “We’ll see what the process brings.” CNN reported earlier this week that the Senate is unlikely to spend much time on the impeachment trial, with sources saying that Democrats could dismiss charges on a simple majority vote before each side argues its case. Mayorkas was impeached by House Republicans over their claims that he had committed high crimes and misdemeanors for his handling of the southern border, even though several constitutional experts have said the evidence does not reach that high bar. Tuesday’s vote was 214 to 213. Three Republicans – Ken Buck of Colorado, Mike Gallagher of Wisconsin, and Tom McClintock of California – voted with Democrats against the measure. Republicans have been investigating Mayorkas’ handling of the border since they reclaimed the House majority, but momentum to plot a swift impeachment of the secretary picked up steam last month as key swing-district Republicans expressed fresh openness to the idea amid a recent surge of migrant crossings at the southern border . In the interview Friday, Mayorkas acknowledged “unanimity” across the political spectrum “that our system in the United States – our immigration system – is broken.” But he called on Republicans in Congress to back bipartisan immigration reform. “I was very privileged and honored to sit with a bipartisan group of senators to fashion legislative fixes that are overdue now for decades,” he said. “It is in fact what the Republicans insisted upon – the bipartisan group of senators delivered, the question that everyone is asking is, was a solution actually desired, or do people want the problem as a tool for politics?” On Navalny’s reported death, Mayorkas told Amanpour in an interview on Friday that, if confirmed, it would mark “tragic news for the world.” “We are, of course, still confirming it, but it speaks to the depravity of Vladimir Putin and our need, as a world, to have resolve against authoritarianism and the invasion of another country that is just yearning for its sovereignty,” Mayorkas told Amanpour. The homeland security secretary criticized House Republicans for blocking additional aid to Ukraine, citing the administration’s efforts to present “a united front against Vladimir Putin.” “The inability to continue with emphasis that leadership on the part of the United States – the uncertainty that we are bringing – only can empower Vladimir Putin, and we have to continue our leadership,” he said. The homeland security secretary also took the opportunity to push back against last week’s special counsel report from Hur, taking issue with Hur’s characterization of Biden as an aging president beset by memory issues. “I’ve interacted with the president countless times,” Mayorkas told Amanpour. “I’ve said publicly the most difficult part about a meeting with President Biden is preparing for it, because he is probing, exacting, and quite detail-oriented and focused.” And he called Hur’s comments on Biden’s ability to recall key events “inappropriate, and a deviation from Department of Justice norms.” “The responsibility of a prosecutor, including a special counsel, is to learn the facts, determine the facts, and apply the law to those facts – that was done, and the conclusion is that no case was there, and therefore the case is closed,” Mayorkas said. “To add the fact that those gratuitous personal remarks were terribly inaccurate only makes it even more inappropriate.”"
cnn,https://www.cnn.com/2024/02/16/politics/house-foreign-aid-border-bill/index.html,"CNN — A small group of bipartisan House lawmakers has unveiled their own plan to send aid to Ukraine, Israel and Taiwan and crack down on illegal crossings at the southern border, an effort to put additional pressure on Speaker Mike Johnson to act on Ukraine aid even as House lawmakers recess until the end of the month. Despite the Senate passing a bipartisan bill that provided $95 billion in aid to Ukraine, Israel and Taiwan earlier this week, Johnson has signaled he won’t bring that bill to the floor in the House as he faces pressure from his right flank not to act on Ukraine aid. It’s not clear that the new bill will break through in a chamber where there has been growing conservative resistance to voting on more aid to Ukraine and likely liberal opposition to some of the immigration provisions included in the bill. The plan, which was authored by 10 members including Pennsylvania Republican Rep. Brian Fitzpatrick and Maine Democrat Rep. Jared Golden, would provide more than $66 billion in military assistance to Ukraine, Israel and Taiwan, but would not provide the same humanitarian aid included in the Senate bill. The legislation would also restore the so-called “Remain in Mexico” policy, which requires individuals seeking asylum to return to Mexico until their case is ready for court in the US. “Securing one’s borders is necessary to preserve one’s democracy and therefore necessary to maintaining world order and world peace,” Fitzpatrick said in a statement. “But we also have an obligation to assist our allies in securing their borders, especially when they come under assault by dictators, terrorists and totalitarians.” Fitzpatrick told CNN that Republicans who authored the bill plan will discuss their legislation with Johnson in the days ahead. But defense hawks in the House and many members running in swing districts in November have warned that they don’t want House Republicans to be the reason Ukraine aid fails. “In the end, I don’t want it to be Republicans’ legacy that Ukraine fell. Period,” Rep. Don Bacon, a Republican from Nebraska, told CNN last week. “We’ve been playing nice talking about the border and trying to link this, but that didn’t work. Now, we are going to be more forceful and forthright that Ukraine is in our national security interest.” There are few options remaining to get Ukraine aid on the floor, something that the White House has said for months is essential to ensuring that the country doesn’t lose its battle against Russia in the months ahead. If Johnson won’t put the legislation on the floor, Democrats could try to convince a handful of Republicans to sign what is known as a discharge petition, an arcane and seldomly used device that would force a vote on Ukraine aid if a majority of the House signs on. It’s not clear that Republicans – even a handful – would be willing to buck their leadership and force that vote. The odds of getting Ukraine aid out of the House has been made even more difficult by the fact that the front-runner to win the GOP nomination for president, Donald Trump, has made clear he’s opposed to the Senate-passed bill. “WE SHOULD NEVER GIVE MONEY ANYMORE WITHOUT THE HOPE OF A PAYBACK, OR WITHOUT ‘STRINGS’ ATTACHED. THE UNITED STATES OF AMERICA SHOULD BE ‘STUPID’ NO LONGER!” Trump posted Saturday on Truth Social."
