source,url,content
cnn,https://www.cnn.com/2024/02/15/politics/mike-turner-republican-reaction/index.html,"House Intelligence Chairman Mike Turner is facing sharp criticism – including from within his own party – as some GOP lawmakers are complaining that a statement the Ohio Republican made Wednesday was alarmist, “constituted poor judgement” and should be investigated. Some of Turner’s colleagues believe he was drawing attention to a Russian threat to build support for Ukraine aid and others believe it was his effort to push for his version of a Foreign Intelligence Surveillance Act overhaul that was facing a vote later in the day. “It’s f***ing bullsh*t,” one prominent House Republican told CNN of Turner’s move. “He ought to lose his job. He did that to get his way on FISA.” Others were just as unnerved by the move. “I don’t know what his motives were it just to me, it just looks bad,” Republican Rep. Tim Burchett of Tennessee told CNN’s Manu Raju. “I have a bad feeling about this.” Another Tennessee Republican, Rep. Andy Ogles, sent a scathing letter to House Speaker Mike Johnson on Thursday calling for an investigation into Turner for his vague statements, calling his disclosure “reckless” and asserting he disregarded of the consequences. “This act constituted poor judgement at a minimum and a complete breach of trust influenced by the pursuit of a political agenda at a maximum … it is with great reticence that I formally request an inquiry as to any impact the Chairman’s statements may have had on U.S. foreign and domestic policy,” Ogles wrote. CNN has reached out to Johnson for comment on the letter. Not long after Turner released his statement warning of a “serious national security threat,” Johnson arranged a last-minute news conference in the Capitol to make clear there’s “no need for public alarm” and clarifying he had already requested a briefing on the matter a month ago. Turner did not give the House speaker’s office a heads up prior to making his public statement characterizing the matter as a “serious national security threat,” according to a source familiar with the matter. Turner did, however, inform Johnson he would be requesting that the Biden administration declassify information about the threat, another source said. GOP Rep. Dan Crenshaw of Texas, a member of the Intelligence Committee, defended Turner’s actions and blasted members who want him investigated. Asked about the letter from Ogles, Crenshaw said, Ogles “needs to f***ing check himself.” “He doesn’t know what he is talking about,” Crenshaw said. “It’s absurd. It’s a deeply absurd action. I am tired of people making extremely passionate, opinionated actions based on no knowledge.” Asked about some of the theories members are floating that Turner was using his position to try and drum up support for Ukraine aid and other theories as to why Turner released the statement, Crenshaw said the timing was just coincidence. “It’s coincidence,” he said. “There was notifications from the intelligence community that made it just clearer now than before. This was just the time.” Turner issued a statement defending his decision to make the national security threat available to members, but the statement does not address why Turner decided to make his statement public, which has caused backlash. Turner said he worked with the Biden administration to notify Congress about the national security threat and that the administration cleared his statement with the top Democrat on the panel before it got sent to lawmakers. The committee voted on Tuesday to release the information to lawmakers, and Turner said that vote was 23-1. Turner’s initial statement came hours before the House was scheduled to take a vote related to reauthorizing the Foreign Intelligence Surveillance Act, a vote that was later postponed due to opposition from the conservative House Freedom Caucus, whose members had been pushing for amendment votes. Members of the Freedom Caucus later tanked a procedural vote on unrelated legislation Wednesday evening. Ogles tied Turner’s statement to trying to drum up support for passing the FISA package. “In hindsight, it has become clear that the intent was not to ensure the safety of our homeland and the American people, but rather to ensure additional funding for Ukraine and passage of an unreformed Foreign Intelligence Surveillance Act (FISA).” GOP Rep. Matt Gaetz accused Turner of “gaslighting the country” about the seriousness of the security threat members were briefed on Thursday in order to promote Ukraine funding. “We put out our concern with Chairman Turner gaslighting the country on these things,” Gaetz told CNN’s Manu Raju. “I worry that the motivation to draw so much attention to this is less about intelligence and national security and more about a politician who wants to send $60 billion to Ukraine,” he said, “and wants to reauthorize the Foreign Intelligence Surveillance Act that we want to see substantially curtailed because of the spying abuses.” CNN reported Wednesday that the US has new intelligence on Russian military capabilities related to its efforts to deploy a nuclear anti-satellite system in space, according to multiple sources familiar with the intelligence. The intelligence was briefed to Congress and key US allies, and some lawmakers say it is serious enough that it should be declassified and made public. One Democratic member with deep national security experience said Wednesday that they had never before received that kind of urgent summons over a national security matter during their time in Congress — and that the intelligence they saw when they arrived was not urgent enough to justify Turner’s comments. CNN’s Lauren Fox, Morgan Rimmer, Manu Raju and Sam Fossum contributed to this report. This story has been updated with additional developments."
cnn,https://www.cnn.com/2024/02/15/politics/texas-immigration-law-doj/index.html,"CNN — A federal judge on Thursday expressed concern and skepticism over a controversial law that makes entering Texas illegally a state crime while hearing oral arguments over a motion for a preliminary injunction to block the law. The measure, SB4, which is set to go into effect on March 5, grants local and state law enforcement the power to arrest migrants and state judges the ability to issue orders to remove them to Mexico. The Department of Justice sued the state , arguing the federal government has exclusive authority to enforce immigration law. US District Judge David Ezra emphasized that he was sympathetic to the state’s concerns about the complicated situation at the border and the issues plaguing the country’s immigration system, making it clear that something must be done to improve the nation’s immigration laws. He also added that he’s served as a federal judge in several cities along the border, including San Diego and Del Rio. But Ezra was not shy in critiquing the bill passed by the state’s legislature last year and fully embraced by Texas Republican Gov. Greg Abbott . Civil rights groups and immigration advocacy groups who are also part of the lawsuit have warned that the bill will separate families, lead to racial profiling and make undocumented migrants who are already in the US fearful of reporting crimes. Ezra sharply questioned several provisions within the law and flat out rejected the state’s argument that an “invasion” was taking place at the Texas-Mexico border. The state argued in the Austin courtroom that SB4 is complementary — not in conflict — with federal law and that Texas is “entitled to defend itself from an invasion,” especially from what it called a “full-scale invasion of transnational criminal cartels.” While he acknowledged the role cartels play in the border crisis, Ezra pushed back at the notion that an influx of migrants constituted an “invasion.” “I really do not see any evidence that Texas is at war,” he said, though he said the state is “definitely under pressure.” Ezra also speculated that if he were to rule that SB4 was “perfectly fine,” it could ignite a domino effect of other states creating their own interpretations of federal immigration law — a situation he described as a “nightmare.” Ryan Walters, an attorney with the Texas attorney general’s office, pointed out that states along the border largely enforced their own immigration laws and deported migrants until the late 1800s. Ezra countered that because the states were “doing their own thing,” Congress stepped in and created a unified law over who can come into the country. Ezra said the law still needs more work, “but that doesn’t mean the law we have isn’t enforceable.” Further, he said the removal provisions in the Texas legislation would burden state judges with making decisions that typically fall within the jurisdiction of immigration judges. He worried parts of the law would confuse judges over whether to follow state or federal statutes, especially when it comes to a migrant who’s legally seeking asylum while also facing felony prosecution from the state. “It is a quandary of some proportion,” Ezra said. The state argued that arresting migrants is not unprecedented for the state, as it’s been arresting migrants for trespassing for more than two years. But the judge argued there was a difference, saying SB4 “goes far beyond that” by allowing a judge to order a migrant to be removed once prosecuted. Ezra said he would rule “as quickly as I possibly can,” assuring both parties he would give enough time for either side to file an appeal. The judge made clear he did not see this case ending quickly. “I would not be surprised at all if this case finds its way to the Supreme Court,” he said. CNN’s Kaanita Iyer contributed to this report."
foxnews,https://www.foxnews.com/politics/joe-manchin-announce-will-not-launch-third-party-presidential-run,"close Video Joe Manchin suggests Mitt Romney, Rob Portman as potential running mates as he flirts with third-party ticket Sen. Joe Manchin, D-W.Va., picks Sen. Mitt Romney, R-Utah, or former Ohio Republican Sen. Rob Portman as potential running mates in a hypothetical third-party ticket on Thursday at the City Club of Cleveland breakfast forum. (City Club of Cleveland) Sen. Joe Manchin, D-W.Va., announced Friday that he will not be running for president, shooting down months of speculation that he would join the race on a third-party ticket. ""I will not be seeking a third-party run, I will not be involved in a presidential run,"" Manchin said. Manchin made the announcement during a speech at West Virginia University as part of his ""listening tour"" that kicked off last month with his daughter's campaign group ""Americans Together"" — a movement that touts itself as the ""moderate majority"" that rejects the ""extremism in politics ."" ""I'm working with my daughter, working with people that we have around Americans Together and putting all my efforts toward that,"" he said Friday. Manchin previously said he would not make a decision on whether he would run until after Super Tuesday on March 5. ""People are looking for options,"" Manchin said at the time. ""And we're going to be looking at that, too."" JOE MANCHIN SUGGESTS MITT ROMNEY, ROB PORTMAN AS POTENTIAL RUNNING MATES AS HE FLIRTS WITH THIRD-PARTY TICKET Sen. Joe Manchin, D-W.Va., was ranked the most bipartisan senator by the Common Ground Committees scorecard. (Getty Images) On Thursday, Manchin said in a hypothetical run he would tap Sen. Mitt Romney , R-Utah, or former Ohio Republican Sen. Rob Portman to be his vice presidential running mate, but later added he's not ""running for anything."" ""Hypothetically, if I was picking my running mate, really who I would ask right now is Mitt Romney,"" Manchin told voters at the City Club of Cleveland breakfast forum Thursday. Romney, a former Massachusetts governor who ran for the White House in 2008 and 2012, jokingly called Manchin's remarks ""presumptuous."" MANCHIN ‘ABSOLUTELY’ CAN SEE HIMSELF AS PRESIDENT, THINKS BIDEN HEALTH OR TRUMP CONVICTION COULD GIVE OPENING Sen. Joe Manchin, D-W.Va., right, and Sen. Mitt Romney, R- Utah, head to a vote as senators make their way to a briefing on the war in Ukraine on Capitol Hill in Washington, D.C., on March 30, 2022. (Jabin Botsford/The Washington Post via Getty Images) ""I would be the president. He would be my running mate,"" Romney said in a statement to Deseret News when asked about Manchin's comment. Romney also announced last year that he would not seek re-election to the Senate when his term expires in 2025. CLICK HERE TO GET THE FOX NEWS APP ""No, I'm not going to run for president,"" he added. ""Certainly I'm not running for vice president. But (Manchin is) kind to say that. We're good friends."" No Labels, the third-party effort that is on the ballot in several states and was rumored to be considering placing Manchin on a presidential ticket, said it is considering other potential candidates for a ""unity ticket."" ""No Labels has spent 14 years working to create a movement for America’s commonsense majority and we welcome Senator Manchin’s efforts to strengthen it,"" No Labels co-chairs former Sen. Joe Lieberman, Dr. Benjamin F. Chavis, Jr., and former North Carolina Gov. Pat McCrory said in a joint statement. ""No Labels is currently speaking with several exceptional leaders about serving on the presidential Unity ticket. We are continuing to make great progress on our ballot access efforts and will announce in the coming weeks whether we will offer our line to a Unity ticket."" Fox News' Aubrie Spady and Paul Steinhauser contributed to this report. Get the latest updates from the 2024 campaign trail, exclusive interviews and more at our Fox News Digital election hub. Jamie Joseph is a writer who covers politics. She leads Fox News Digital coverage of the Senate."
foxnews,https://www.foxnews.com/politics/mitt-romney-not-going-to-run-for-president-2024-after-being-floated-manchin-vp-pick,"close Video Joe Manchin suggests Mitt Romney, Rob Portman as potential running mates as he flirts with third-party ticket Sen. Joe Manchin, D-W.Va., picks Sen. Mitt Romney, R-Utah, or former Ohio Republican Sen. Rob Portman as potential running mates in a hypothetical third-party ticket on Thursday at the City Club of Cleveland breakfast forum. (City Club of Cleveland) Sen. Mitt Romney, R-Utah, said that he does not have any plans to run for president or vice president in 2024. Romney's comment came after Democrat Sen. Joe Manchin , D-W.Va., said he would pick either Romney or former Ohio Republican Sen. Rob Portman as a running mate if he jumped into the 2024 presidential race. ""Hypothetically, if I was picking my running mate, really who I would ask right now is Mitt Romney,"" Manchin, who has left the door open to a third-party presidential run, told voters Thursday at the City Club of Cleveland breakfast forum. Manchin, however, added that he was not ""not running for anything."" Romney, a former Massachusetts governor who ran for the White House in 2008 and 2012, squashed the rumors and noted he would ""certainly"" not be a vice president. JOE MANCHIN SUGGESTS ROMNEY, ROB PORTMAN AS POTENTIAL RUNNING MATES AS HE FLIRTS WITH THIRD-PARTY TICKET Sen. Mitt Romney, R-Utah, questions Office of Management Director Shalanda D. Young during a Senate Budget Committee hearing titled ""The President's Fiscal Year 2024 Budget Proposal"" in the Dirksen Building in Washington, D.C., on March 15, 2023. ""Well, that's really presumptuous. I would be the president. He would be my running mate,"" Romney joked in a statement to Deseret News when asked about Manchin's comment. MANCHIN ‘ABSOLUTELY’ CAN SEE HIMSELF AS PRESIDENT, THINKS BIDEN HEALTH OR TRUMP CONVICTION COULD GIVE OPENING ""No, I'm not going to run for president,"" he added. ""Certainly I'm not running for vice president. But (Manchin is) kind to say that. We're good friends."" Sen. Joe Manchin, D-W.Va., right, and Sen. Mitt Romney, R- Utah. (Jabin Botsford) After flirting with a third-party White House run for months, Manchin on Friday said he wouldn't bid for the presidency. ""I will not be seeking a third-party run, i will not be involved in a presidential run,"" Manchin announced during a speech in West Virginia. CLICK HERE TO GET THE FOX NEWS APP Romney was the Republican presidential nominee in 2012, sparking rumors he might be considering a third run at the White House after deciding not to seek re-election in the Senate in 2024. Romney also added that he will ""not"" be voting for former President Trump if he is the 2024 GOP nominee. Fox News' Jamie Joseph contributed to this report. Get the latest updates from the 2024 campaign trail, exclusive interviews and more at our Fox News Digital election hub. Aubrie Spady is a Production Assistant for Fox News Digital."
foxnews,https://www.foxnews.com/politics/dem-backed-chinese-firm-razing-trees-in-michigan-to-make-way-for-ev-plant,"close Video Former CIA Director Leon Panetta warns that China may use Michigan EV plant for espionage Leon Panetta told lawmakers that a proposed electric vehicle battery plant in Michigan could be used for Chinese espionage. A Chinese green energy firm backed by Michigan's state government is tearing down trees to make way for a proposed electric vehicle (EV) battery plant designed to help the state meet its climate goals. Gotion Inc. — whose parent company is Hefei, China-based Gotion High-Tech — said it has initiated its tree-cutting process this week to make way for its controversial EV project in Mecosta County, Michigan, which has received support from Democrats and climate activists, but opposition from Republicans and national security experts. The firm said the process is legal and pushed back against concerns raised by locals. ""It’s unfortunate that some extremist groups have targeted Mecosta County area businesses that want to work with Gotion Inc. to grow and strengthen jobs in our region,"" said Chuck Thelen, Gotion’s vice president of North American operations. ""A small minority of people continue to spread misinformation and manufacture lies about Gotion Inc., which invariably leads some residents to act out and make threats,"" he continued. ""Despite these attempts at intimidation, the legal selective cutting of trees will start on Feb. 14."" FORD PLANS TO HIRE CHINESE MILITARY SOFTWARE SUPPLIER FOR EV FACTORY IN US: GOP INVESTIGATORS Michigan Gov. Gretchen Whitmer delivers her State of the State address to a joint session of the House and Senate on January 24 in Lansing, Michigan. (AP Photo/Al Goldis) Gotion first unveiled its development plans for the project in October 2022 alongside Democratic Gov. Gretchen Whitmer , agreeing to invest $2.4 billion in two 550,000-square-foot production plants and other supporting facilities across a large plot of land in Green Charter Township. Then, in August, the firm purchased 270 acres of land for the project, including land zoned for industrial, agricultural and residential use. However, amid increasing opposition to the project over Gotion's ties to the Chinese Communist Party , the project has faced delays even as the Whitmer administration has earmarked nearly $200 million in taxpayer funding for the development. While mass tree-cutting to make way for construction was originally slated to occur late last year, the process was delayed until this week. 120 REPUBLICANS JOIN EFFORT OPPOSING BIDEN'S 'DE FACTO EV MANDATE' Crain's Detroit Business reported earlier this week that one local logging business had been awarded the contract but ultimately backed out over the sustained local opposition, saying they didn't want to be ""tied up in a bunch of gobbledygook."" The opposition appears to have been spearheaded, in part, by Marjorie Steele, the founder of the Economic Development Responsibility Alliance of Michigan. Li Zhen, the founder and chairman of Gotion High Tech, speaks during the Bloomberg New Economy Forum in Singapore, on November 10, 2023. Gotion High-Tech's corporate bylaws say the company is required to ""carry out Party activities in accordance with the Constitution of the Communist Party of China."" (Lionel Ng/Bloomberg via Getty Images) ""To date, Gotion has applied for no environmental permits through EGLE, no soil erosion permits through the county, and has presented no site plan to local or state agencies. Yet Gotion is preparing to log the site before the end of the month,"" Steele wrote to the local U.S. Environmental Protection Agency office last month. ""This environmental situation is about to come to a head,"" she continued. ""We as representatives of the local community ask once more, urgently, that EPA Region 5’s offices take action on the federal oversight required of this development, before violations occur."" 17 RETIRED MILITARY OFFICIALS RAISE ALARM ON BIDEN'S ELECTRIC VEHICLE PUSH In a statement to Fox News Digital, Michigan Department of Environment, Great Lakes, and Energy spokesperson Jeff Johnston confirmed that Gotion has yet to file any permit applications with the agency regarding its project or tree-cutting plans. However, he said that permits are only required if the work is to be done on wetlands. Michigan Governor Gretchen Whitmer engages in a conversation with former Secretary of State Hillary Clinton, left, and Illinois Governor J.B. Pritzker, center, on September 19, 2023, in New York City. Gotion has developed plans in both Michigan and Illinois. (John Nacion/WireImage via Getty Images) ""Cutting trees does not require a permit from EGLE if the cutting does not occur within a regulated wetland,"" Johnston said. In addition to locals, the project has received pushback from state and federal lawmakers, in addition to national security experts. In a House hearing last month, former CIA Directors Leon Panetta and Mike Pompeo warned that Gotion's project could be covertly used by Chinese assets for espionage. CLICK HERE TO GET THE FOX NEWS APP This week, Republican Michigan state Sens. Jonathan Lindsey and Lana Theis demanded the Whitmer administration to halt funding for the project in light of the concerns raised by Panetta and Pompeo. ""National security experts from both sides of the aisle have sounded the alarm about China’s attempts to infiltrate and compromise our safety through industrial espionage,"" Lindsey said in a statement on Wednesday. ""Yet, Gov. Gretchen Whitmer continues to ignore their warnings and further place our state and nation at risk — while using taxpayer dollars to do so."" Whitmer's office didn't respond to a request for comment. Thomas Catenacci is a politics writer for Fox News Digital."
